{
  "$schema": "https://cdn.jsdelivr.net/gh/forge-arcana/kod-data@main/schema/econ.schema.json",
  "dataset": "econ",
  "base": "USD",
  "unit": "multiplier",
  "date": "2026-10-08",
  "updated": "2026-10-09T04:38:26.088Z",
  "reference": "US",
  "multiplierFloor": 0.05,
  "incomeGroups": [
    "Low income",
    "Lower middle income",
    "Upper middle income",
    "High income"
  ],
  "sources": [
    "worldbank-income",
    "worldbank-gni"
  ],
  "sourcesMeta": {
    "worldbank-income": {
      "date": "2026-10-08"
    },
    "worldbank-gni": {
      "date": "2026-10-08"
    }
  },
  "countries": {
    "AD": {
      "name": "Andorra",
      "multiplier": 0.9046,
      "incomeGroup": "High income",
      "gniPerCapitaPppUsd": 80950,
      "dataYear": 2025,
      "basis": "gni_ppp"
    },
    "AE": {
      "name": "United Arab Emirates",
      "multiplier": 0.9123,
      "incomeGroup": "High income",
      "gniPerCapitaPppUsd": 81640,
      "dataYear": 2024,
      "basis": "gni_ppp"
    },
    "AF": {
      "name": "Afghanistan",
      "multiplier": 0.05,
      "incomeGroup": "Low income",
      "gniPerCapitaPppUsd": 2250,
      "dataYear": 2024,
      "basis": "gni_ppp"
    },
    "AG": {
      "name": "Antigua and Barbuda",
      "multiplier": 0.3874,
      "incomeGroup": "High income",
      "gniPerCapitaPppUsd": 34670,
      "dataYear": 2025,
      "basis": "gni_ppp"
    },
    "AL": {
      "name": "Albania",
      "multiplier": 0.3148,
      "incomeGroup": "Upper middle income",
      "gniPerCapitaPppUsd": 28170,
      "dataYear": 2025,
      "basis": "gni_ppp"
    },
    "AM": {
      "name": "Armenia",
      "multiplier": 0.2684,
      "incomeGroup": "Upper middle income",
      "gniPerCapitaPppUsd": 24020,
      "dataYear": 2025,
      "basis": "gni_ppp"
    },
    "AO": {
      "name": "Angola",
      "multiplier": 0.11,
      "incomeGroup": "Lower middle income",
      "gniPerCapitaPppUsd": 9840,
      "dataYear": 2025,
      "basis": "gni_ppp"
    },
    "AR": {
      "name": "Argentina",
      "multiplier": 0.3567,
      "incomeGroup": "Upper middle income",
      "gniPerCapitaPppUsd": 31920,
      "dataYear": 2025,
      "basis": "gni_ppp"
    },
    "AS": {
      "name": "American Samoa",
      "multiplier": 0.6584,
      "incomeGroup": "High income",
      "gniPerCapitaPppUsd": null,
      "dataYear": null,
      "basis": "income_group"
    },
    "AT": {
      "name": "Austria",
      "multiplier": 0.8605,
      "incomeGroup": "High income",
      "gniPerCapitaPppUsd": 77010,
      "dataYear": 2025,
      "basis": "gni_ppp"
    },
    "AU": {
      "name": "Australia",
      "multiplier": 0.7814,
      "incomeGroup": "High income",
      "gniPerCapitaPppUsd": 69930,
      "dataYear": 2025,
      "basis": "gni_ppp"
    },
    "AW": {
      "name": "Aruba",
      "multiplier": 0.5464,
      "incomeGroup": "High income",
      "gniPerCapitaPppUsd": 48900,
      "dataYear": 2024,
      "basis": "gni_ppp"
    },
    "AZ": {
      "name": "Azerbaijan",
      "multiplier": 0.2842,
      "incomeGroup": "Upper middle income",
      "gniPerCapitaPppUsd": 25430,
      "dataYear": 2025,
      "basis": "gni_ppp"
    },
    "BA": {
      "name": "Bosnia and Herzegovina",
      "multiplier": 0.2884,
      "incomeGroup": "Upper middle income",
      "gniPerCapitaPppUsd": 25810,
      "dataYear": 2025,
      "basis": "gni_ppp"
    },
    "BB": {
      "name": "Barbados",
      "multiplier": 0.2776,
      "incomeGroup": "High income",
      "gniPerCapitaPppUsd": 24840,
      "dataYear": 2025,
      "basis": "gni_ppp"
    },
    "BD": {
      "name": "Bangladesh",
      "multiplier": 0.1197,
      "incomeGroup": "Lower middle income",
      "gniPerCapitaPppUsd": 10710,
      "dataYear": 2025,
      "basis": "gni_ppp"
    },
    "BE": {
      "name": "Belgium",
      "multiplier": 0.845,
      "incomeGroup": "High income",
      "gniPerCapitaPppUsd": 75620,
      "dataYear": 2025,
      "basis": "gni_ppp"
    },
    "BF": {
      "name": "Burkina Faso",
      "multiplier": 0.05,
      "incomeGroup": "Low income",
      "gniPerCapitaPppUsd": 2890,
      "dataYear": 2025,
      "basis": "gni_ppp"
    },
    "BG": {
      "name": "Bulgaria",
      "multiplier": 0.4712,
      "incomeGroup": "High income",
      "gniPerCapitaPppUsd": 42170,
      "dataYear": 2025,
      "basis": "gni_ppp"
    },
    "BH": {
      "name": "Bahrain",
      "multiplier": 0.7319,
      "incomeGroup": "High income",
      "gniPerCapitaPppUsd": 65500,
      "dataYear": 2025,
      "basis": "gni_ppp"
    },
    "BI": {
      "name": "Burundi",
      "multiplier": 0.05,
      "incomeGroup": "Low income",
      "gniPerCapitaPppUsd": 1250,
      "dataYear": 2025,
      "basis": "gni_ppp"
    },
    "BJ": {
      "name": "Benin",
      "multiplier": 0.05319,
      "incomeGroup": "Lower middle income",
      "gniPerCapitaPppUsd": 4760,
      "dataYear": 2025,
      "basis": "gni_ppp"
    },
    "BM": {
      "name": "Bermuda",
      "multiplier": 1.369,
      "incomeGroup": "High income",
      "gniPerCapitaPppUsd": 122530,
      "dataYear": 2024,
      "basis": "gni_ppp"
    },
    "BN": {
      "name": "Brunei Darussalam",
      "multiplier": 1.066,
      "incomeGroup": "High income",
      "gniPerCapitaPppUsd": 95420,
      "dataYear": 2025,
      "basis": "gni_ppp"
    },
    "BO": {
      "name": "Bolivia",
      "multiplier": 0.14,
      "incomeGroup": "Lower middle income",
      "gniPerCapitaPppUsd": 12530,
      "dataYear": 2025,
      "basis": "gni_ppp"
    },
    "BR": {
      "name": "Brazil",
      "multiplier": 0.2533,
      "incomeGroup": "Upper middle income",
      "gniPerCapitaPppUsd": 22670,
      "dataYear": 2025,
      "basis": "gni_ppp"
    },
    "BS": {
      "name": "Bahamas, The",
      "multiplier": 0.4426,
      "incomeGroup": "High income",
      "gniPerCapitaPppUsd": 39610,
      "dataYear": 2024,
      "basis": "gni_ppp"
    },
    "BT": {
      "name": "Bhutan",
      "multiplier": 0.207,
      "incomeGroup": "Lower middle income",
      "gniPerCapitaPppUsd": 18520,
      "dataYear": 2025,
      "basis": "gni_ppp"
    },
    "BW": {
      "name": "Botswana",
      "multiplier": 0.223,
      "incomeGroup": "Upper middle income",
      "gniPerCapitaPppUsd": 19960,
      "dataYear": 2025,
      "basis": "gni_ppp"
    },
    "BY": {
      "name": "Belarus",
      "multiplier": 0.3834,
      "incomeGroup": "Upper middle income",
      "gniPerCapitaPppUsd": 34310,
      "dataYear": 2025,
      "basis": "gni_ppp"
    },
    "BZ": {
      "name": "Belize",
      "multiplier": 0.159,
      "incomeGroup": "Upper middle income",
      "gniPerCapitaPppUsd": 14230,
      "dataYear": 2025,
      "basis": "gni_ppp"
    },
    "CA": {
      "name": "Canada",
      "multiplier": 0.7467,
      "incomeGroup": "High income",
      "gniPerCapitaPppUsd": 66820,
      "dataYear": 2025,
      "basis": "gni_ppp"
    },
    "CD": {
      "name": "Congo, Dem. Rep.",
      "multiplier": 0.05,
      "incomeGroup": "Low income",
      "gniPerCapitaPppUsd": 1850,
      "dataYear": 2025,
      "basis": "gni_ppp"
    },
    "CF": {
      "name": "Central African Republic",
      "multiplier": 0.05,
      "incomeGroup": "Low income",
      "gniPerCapitaPppUsd": 1390,
      "dataYear": 2025,
      "basis": "gni_ppp"
    },
    "CG": {
      "name": "Congo, Rep.",
      "multiplier": 0.07252,
      "incomeGroup": "Lower middle income",
      "gniPerCapitaPppUsd": 6490,
      "dataYear": 2025,
      "basis": "gni_ppp"
    },
    "CH": {
      "name": "Switzerland",
      "multiplier": 1.136,
      "incomeGroup": "High income",
      "gniPerCapitaPppUsd": 101690,
      "dataYear": 2025,
      "basis": "gni_ppp"
    },
    "CI": {
      "name": "Cote d'Ivoire",
      "multiplier": 0.0866,
      "incomeGroup": "Lower middle income",
      "gniPerCapitaPppUsd": 7750,
      "dataYear": 2025,
      "basis": "gni_ppp"
    },
    "CL": {
      "name": "Chile",
      "multiplier": 0.3993,
      "incomeGroup": "High income",
      "gniPerCapitaPppUsd": 35730,
      "dataYear": 2025,
      "basis": "gni_ppp"
    },
    "CM": {
      "name": "Cameroon",
      "multiplier": 0.06369,
      "incomeGroup": "Lower middle income",
      "gniPerCapitaPppUsd": 5700,
      "dataYear": 2025,
      "basis": "gni_ppp"
    },
    "CN": {
      "name": "China",
      "multiplier": 0.3258,
      "incomeGroup": "Upper middle income",
      "gniPerCapitaPppUsd": 29160,
      "dataYear": 2025,
      "basis": "gni_ppp"
    },
    "CO": {
      "name": "Colombia",
      "multiplier": 0.2486,
      "incomeGroup": "Upper middle income",
      "gniPerCapitaPppUsd": 22250,
      "dataYear": 2025,
      "basis": "gni_ppp"
    },
    "CR": {
      "name": "Costa Rica",
      "multiplier": 0.3437,
      "incomeGroup": "High income",
      "gniPerCapitaPppUsd": 30760,
      "dataYear": 2025,
      "basis": "gni_ppp"
    },
    "CU": {
      "name": "Cuba",
      "multiplier": 0.2232,
      "incomeGroup": "Upper middle income",
      "gniPerCapitaPppUsd": null,
      "dataYear": null,
      "basis": "income_group"
    },
    "CV": {
      "name": "Cabo Verde",
      "multiplier": 0.1342,
      "incomeGroup": "Upper middle income",
      "gniPerCapitaPppUsd": 12010,
      "dataYear": 2025,
      "basis": "gni_ppp"
    },
    "CW": {
      "name": "Curacao",
      "multiplier": 0.3724,
      "incomeGroup": "High income",
      "gniPerCapitaPppUsd": 33330,
      "dataYear": 2024,
      "basis": "gni_ppp"
    },
    "CY": {
      "name": "Cyprus",
      "multiplier": 0.6413,
      "incomeGroup": "High income",
      "gniPerCapitaPppUsd": 57390,
      "dataYear": 2025,
      "basis": "gni_ppp"
    },
    "CZ": {
      "name": "Czechia",
      "multiplier": 0.6467,
      "incomeGroup": "High income",
      "gniPerCapitaPppUsd": 57870,
      "dataYear": 2025,
      "basis": "gni_ppp"
    },
    "DE": {
      "name": "Germany",
      "multiplier": 0.8732,
      "incomeGroup": "High income",